Groupe05/Image-Captioning-RAG/03_analysis/01_statistical_exploration/outputs/tables/pos_distribution.csv

POS,Frequency,Percentage
NOUN,179165,34.52738159246262
DET,106217,20.46937119753636
ADP,87364,16.836157538826804
VERB,50435,9.719468035698112
ADJ,37191,7.167180246171279
AUX,12222,2.3553353491088
CCONJ,12178,2.3468559876818005
PRON,11551,2.2260250873470584
ADV,7420,1.4299286770076334
NUM,6325,1.21890820513117
PROPN,4548,0.8764576311362151
PART,2156,0.4154887099229727
SCONJ,2025,0.3902433384016789
X,62,0.011948191101681034
INTJ,45,0.008672074186703975
PUNCT,3,0.0005781382791135984

Groupe05/Image-Captioning-RAG/03_analysis/01_statistical_exploration/report/statistical_exploration.md

#### Discussion

Nouns represent the largest POS category, accounting for approximately 34.53% of the analysed tokens. This is expected in image descriptions because captions frequently identify the people, animals, and objects present in a scene.

Determiners and adpositions are also common, representing 20.47% and 16.84%, respectively. Verbs account for 9.72%, while adjectives represent 7.17%.